{
  "$schema": "https://raw.githubusercontent.com/Nyarlathoteppppp/pi-tool-explain/main/config/config.schema.json",
  "version": 2,
  "intent": {
    "language": "zh-CN",
    "maxLength": 96
  },
  "toolCalls": {
    "layout": "individual",
    "showContextGrowth": false,
    "bashCommandPreviewRows": 1
  },
  "results": {
    "mode": "summary",
    "previewRows": 10
  },
  "diff": {
    "layout": "auto",
    "indicators": "bars",
    "splitMinWidth": 120,
    "collapsedRows": 24,
    "collapsedMode": "body",
    "wordWrap": true
  },
  "tools": {
    "passthrough": [],
    "custom": {
      "web_search": {
        "renderer": "generic",
        "mode": "summary"
      }
    }
  },
  "advanced": {
    "expandedRows": 500,
    "truncationHints": false,
    "rtkCompactionHints": false,
    "debug": false
  }
}
